<?xml version="1.0" encoding="UTF-8"?>
<scaffolding id="basic-app" xmlns="http://quakearts.com/scaffolding"
	xmlns:xsi="http://www.w3.org/2001/XMLSchema-instance"
	xsi:schemaLocation="http://quakearts.com/scaffolding ../model/scaffolding.xsd ">
	<properties>
		<entry displayName="CRUD Managed Bean Class Name" property="crudappClassName">CRUDApplicationBean</entry>
		<entry displayName="CRUD Managed Bean Name" property="crudappBeanName">crudapp</entry>
	</properties>
	<template-group folderID="cp">
		<template filename="@{beanName}.crud.xhtml" location="basic/crud.xhtml" />
	</template-group>
	<template-group folderID="beans">
		<template location="basic/finder.vm" filename="@{beanClassSimpleName}Finder.java"/>
		<template location="crudapp/dropdownhelper.vm" filename="@{beanClassSimpleName}DropdownHelper.java"/>
		<template location="crudapp/page.vm" filename="@{beanClassSimpleName}Page.java"/>
	</template-group>
	<resource folderID="beans" location="crudapp/crudappapplicationbean.vm" filename="@{crudappClassName}.java" template="true" />
	<folder-structure>
		<folder name="Root Folder" folderID="root">
			<folder name="src" folderID="src">
				<folder folderID="com" name="com">
					<folder folderID="quakearts" name="quakearts">
						<folder folderID="webapp" name="webapp">
							<folder folderID="beans" name="beans" />
						</folder>
					</folder>
				</folder>
			</folder>
			<folder name="WebContent" folderID="web">
				<folder name="cp" folderID="cp" />
			</folder>
		</folder>
	</folder-structure>
</scaffolding>
